{
  "schemaVersion": "1.0",
  "id": "SAMPLE-001",
  "sequence": 1,
  "title": "입력의 필수 여부 확인과 사용 전 검증",
  "sourceMapping": "exact",
  "summary": "입력이 없을 때의 정책이 명시되지 않은 채 값을 사용합니다.",
  "applicability": "입력이 필수인지 확인한 뒤 보고서 가이드의 적용 방법을 결정합니다.",
  "steps": [
    "서비스 경계에서 필수·선택 입력 계약을 확인합니다.",
    "확인한 계약에 맞는 최소 검증 또는 대체 동작을 추가합니다."
  ],
  "checkpoints": [
    "필수 입력을 임의의 빈 기본값으로 바꾸지 않습니다.",
    "함수 계약을 바꾸기 전에 모든 호출부를 확인합니다."
  ],
  "impact": ["입력 오류 처리 동작이 바뀔 수 있습니다."],
  "testPlan": ["입력 누락과 정상 입력 동작을 검증합니다."],
  "duplicateGroup": "",
  "relatedIds": [],
  "policyQuestions": ["이 화면에서 이 항목 없이도 진행할 수 있나요?"],
  "evidence": [
    {
      "source": "source",
      "detail": "현재 함수는 검증 전에 입력을 역참조합니다."
    },
    {
      "source": "report",
      "detail": "체커는 사용 전 입력 검증을 권고합니다."
    }
  ]
}
